NAME,JD,WD,AREA,FLAG,TAGONE,TAGONENAME,TAGTWO,TAGTWONAME,REGIONID
云南白药集团股份有限公司团结宿舍,102.703161,25.039863,KunMing,1,5,商务住宅,500,住宅小区,511
梦香居NO．3,102.70087,25.0386,KunMing,3,5,商务住宅,500,住宅小区,511
国兴大厦,102.70079,25.03809,KunMing,3,5,商务住宅,501,办公楼宇、大厦,511
云南省地税局直属征收局税务违法案件举报中心,102.702011,25.039652,KunMing,3,2,政府机构及社会团体,200,政府机构,511
昆明市五华区园林绿化局,102.701711,25.037482,KunMing,3,2,政府机构及社会团体,200,政府机构,511
昆明市五华区食品药品监督管理局（旧）,102.702651,25.039295,KunMing,3,2,政府机构及社会团体,200,政府机构,511
云南省政府国资委,102.703734,25.039442,KunMing,3,2,政府机构及社会团体,200,政府机构,511
云南省文化厅,102.703055556,25.0386111111,KunMing,3,2,政府机构及社会团体,200,政府机构,511
